{
  "capabilities": {
    "auth": "api-token",
    "readOnly": true,
    "streaming": false
  },
  "id": "odata",
  "kind": "read-api",
  "label": "OData / Power BI",
  "notes": "Read-only OData entity sets for Power BI / Excel.",
  "route": "GET /api/odata",
  "tools": [
    "Projects",
    "Issues",
    "Portfolio"
  ]
}
