{
  "capabilities": {
    "auth": "api-token",
    "readOnly": true,
    "streaming": false
  },
  "id": "airflow",
  "kind": "batch-egress",
  "label": "Apache Airflow (scheduled egress)",
  "notes": "An async orchestrator — NOT a live data hop, so it lives in the outputs plane, not the broker plane. A scheduled DAG pulls portfolio data through the read APIs (OData/BI feeds) and lands it downstream, or consumes outbound events to trigger batch work. Same honest limit as Zapier/IFTTT.",
  "route": "scheduled DAG → GET /api/odata + /api/bi/feeds (read), webhooks (trigger)",
  "tools": [
    "projects",
    "issues",
    "portfolio_health",
    "notification"
  ]
}
